{
  "$schema": "../../schemas/leo-plugin.schema.json",
  "id": "sub-agents",
  "package": "leo-plugin-sub-agents",
  "version": "0.0.0",
  "status": "planned",
  "description": "子代理：把任务委派给独立上下文的子 Agent 执行并汇总结果",
  "keywords": ["agent", "sub-agent", "delegation"],
  "leo": ">=0.1.0",
  "entry": "./dist/index.js",
  "bundle": "./dist/sub-agents.bundle.js",
  "inject": ["agentLoop", "tools"],
  "provides": {
    "services": ["subAgents"],
    "tools": ["task"],
    "events": ["sub-agents/started", "sub-agents/finished"]
  },
  "permissions": ["agent.spawn"],
  "install": {
    "config": "leo-plugin-sub-agents",
    "example": ["leo-plugin-sub-agents", { "maxConcurrent": 4 }]
  }
}
