{
  "$schema": "../../schemas/leo-plugin.schema.json",
  "id": "provider-deepseek",
  "package": "leo-plugin-provider-deepseek",
  "version": "0.3.0",
  "status": "experimental",
  "description": "模型供应商注册层的 DeepSeek 子插件：deepseek-flash / deepseek-v4-pro，保存密钥即自动接入，思考模式与工具调用开箱可用，旧模型名 deepseek-chat / deepseek-reasoner 自动改写（需要 provider ≥ 0.1.0）",
  "keywords": [
    "provider",
    "deepseek",
    "llm"
  ],
  "leo": ">=0.2.0",
  "entry": "./dist/index.js",
  "bundle": "./dist/provider-deepseek.bundle.js",
  "inject": [
    "providers"
  ],
  "provides": {
    "services": [],
    "tools": [],
    "events": []
  },
  "permissions": [
    "net.connect"
  ],
  "install": {
    "config": "leo-plugin-provider-deepseek",
    "example": [
      "leo-plugin-provider-deepseek",
      {}
    ]
  },
  "release": {
    "version": "0.2.0",
    "bundle": {
      "url": "https://raw.githubusercontent.com/CherryKingOne/leo-plugin/bundles/provider-deepseek/0.2.0/provider-deepseek.bundle.js",
      "sha256": "ea557942d91949fbc026658f60533ef756a9c4d2286a5ada12c55d08a3bc79a1"
    }
  }
}
